,Unnamed: 0,tweet_id,date,text,user,preproc
0,0,1532148597231329281,2022-06-01 23:54:26+00:00,"@ibiapina_ju Pra mim, liberou. Não sou do Javascript... aqui é C/C++, Python, Java, GO Lang, Shell Script. Então, deve ser aleatório! Kkkkk kkkkk kkkkk kkkkk kkkkk",WillianBR,ibiapina_ju pra mim liberar javascript c c python java go lang shell script aleatório kkkkk kkkkk kkkkk kkkkk kkkkk
1,1,1532148392406786048,2022-06-01 23:53:37+00:00,// tenho um hc muito foda em que o Python ficou viciado em Paula Pimenta por culpa da Agatha e do Kyler,PythonMamba1,hc foder python ficar viciar paula pimenta culpar agatha kyler
2,2,1532146808729788416,2022-06-01 23:47:19+00:00,minha linguagem de amor é python e java,Kaiocidral,linguagem amor python java
3,3,1532146770423209989,2022-06-01 23:47:10+00:00,"// mt foda cenar com o Kyler e com o Python ao mesmo tempo

de um lado temos o Kyler, hiperativo e extrovertidasso, conversando cm geral e gritando, cheio de gíria 

e do outro temos o Python, todo fofinho, introvertido e fala formalmente",PythonMamba1,mt foder cenar kyler python kyler hiperativo extrovertidasso conversar cm gritar cheio gírio outro python fofo introverter falir formalmente
4,4,1532145585641377792,2022-06-01 23:42:28+00:00,"@paulaopnions Oloco! Python é a mais fácil de aprender (dizem, simplesmente acreditei). Você trabalha com isso amg?",bi_dickinson,paulaopnions oloco python fácil aprender simplesmente acreditar trabalhar amg
5,5,1532144663469096961,2022-06-01 23:38:48+00:00,O pior de tudo é que eu to achando fácil porque estudei um pouco de Python ano passado (durante um breve surto em que pensei em largar o mestrado) e agora tá vindo a calhar,rafaelhett,mal to achar fácil estudar python ano passar durante surtir pensar largar mestrado tá calhar
6,6,1532143902039453697,2022-06-01 23:35:46+00:00,o diagnóstico é de teoria. questão 1a: como essa equação poderia ser resolvida em python,tepiferreira,diagnóstico teoria equação poder resolvido python
7,7,1532142400461803521,2022-06-01 23:29:48+00:00,"@FelippeRegazio Cara, tem gente que literalmente vive disso. Eu já fui MUITO bom, apesar de não usar praticamente nada de VB, fiz planilhas cabulosas pra resolver n problemas. E eu programo, já fui dev profissional, já programei em C, C++, Python, etc. Tem problemas pros quais Excel é a solução.",carribeiro,felipperegazio caro gente literalmente viver apesar praticamente vb fazer planilhas cabulosas pra resolver n problema programar dev profissional programar c c python etc problema pros excel solução
8,8,1532142375694487552,2022-06-01 23:29:42+00:00,Nunca imaginei que ia fazer prova de Python no papel,petryxxx,imaginar ir provar python papel
9,9,1532141917420539905,2022-06-01 23:27:53+00:00,python eu te odeio eu te odeio,nicotrombeste,python odiar odiar
10,10,1532140504212807681,2022-06-01 23:22:16+00:00,"Vaga de estágio home office na BLU. Conhecimentos básicos de Python e SQL. 🙏

https://t.co/JYAqG0zrXP

cc @sseraphini 
@ViUmaVaga 
#bolhadev",futuro_d3v,vago estágio home office blu conhecimento básico python sql https t co jyaqg zrxp c sseraphini viumavaga bolhadev
11,11,1532136720845705224,2022-06-01 23:07:14+00:00,"@mikaacaroline Uma python não é venenosa, igual a mim, somente linda, invejosa u-u",elfo_jeangolas,mikaacaroline python venenoso igual mim lindo invejoso u u
12,12,1532134489144578050,2022-06-01 22:58:22+00:00,"@mechamoshin Calma. Você quer R ou python? 
Quando for postar alguma dúvida poste utilizando #RStats q ai dão rt.",Takaitakuji,mechamoshin calmo r python postar algum dúvida postar utilizar rstats q ai rt
13,13,1532133344728817672,2022-06-01 22:53:49+00:00,@luzfcb @calalleni @lskbr @dunossauro @fmasanori @PyLadiesBrasil @InspirAdaNaComp Todas as dicas do @luzfcb são bem válidas. Os casos de uso da programação na área de direito tbm. Trabalhei um tempo numa empresa do setor e era por ai que usávamos programação.  Python é uma linguagem mto boa pq dá pra vc usar para fazer bastante coisa interessante. (1),Lidy_Monteiro,luzfcb calalleni lskbr dunossauro fmasanori pyladiesbrasil inspiradanacomp dica luzfcb válido caso usar programação direito tbm trabalhar empresar setor ai usar programação python linguagem mto pq pra vc interessante
14,14,1532131232091455489,2022-06-01 22:45:26+00:00,"comecei a me envolver com drogas pesadas…

…curso de programação em python",taveirao,começar envolver drogar pesar cursar programação python
15,15,1532129940229042176,2022-06-01 22:40:18+00:00,"acabei de começar em HTML e css, por enquanto eu tô amando, será q eu vou pirar igual foi nos meses finais do meu aprendizado em python?",Wosn027,acabar começar html css tô amar ser q ir pirar igual finar aprendizado python
16,16,1532128504195821569,2022-06-01 22:34:35+00:00,"Perfil do @rochacbruno, que é um grande contribuir com ferramentas e plugins para Python (Dynaconf, python-project-template), além de ajudar em conferências e criação de conteúdo na área

https://t.co/9JTpHtUBpf",cmaiacd,perfil rochacbruno contribuir ferramenta plugins python dynaconf python project template ajudar conferência criação conteúdo https t co jtphtubpf
17,17,1532127918436061188,2022-06-01 22:32:15+00:00,"Daqui a pouco vamos conversar com o Macca, baixista do Detonautas, que é mó fã de cultura pop e de Monty Python tbm!!
No canal do Monty Python Brasil. Entra lá!!

Link nos comentários https://t.co/tuYSSZVc6V",andartolo,daqui ir conversar macca baixista detonautas mó fã cultura pop monty python tbm canal monty python brasil entrar link comentário https t co tuysszvc v
18,18,1532126173773406208,2022-06-01 22:25:20+00:00,As vezes o mundo parece uma esquete do Monty Python,mor_fati_,mundo esquete monty python
19,19,1532124915473821700,2022-06-01 22:20:20+00:00,"WebApp JS

Este é um pequeno modelo de App usando as tecnologias WebStack.
Foram diversas ocasiões em que tive de usar a programação para agilizar a introdução de dados e cálculos.

#javascript #python #ispol

https://t.co/OHu6sQyNxl",JCoimbras,webapp js pequeno modelar app usar tecnologia webstack diverso ocasião programação agilizar introdução dar cálculo javascript python ispol https t co ohu sqynxl
20,20,1532123696600588290,2022-06-01 22:15:29+00:00,Alguém de machine learning aqui? Uma multivariate regression tree é a mesma coisa que uma decision tree? O pacote do R pra faze mrt eh mt antigo dai queria sabe se n tem no python rs.,mechamoshin,alguém machine learning multivariate regression tree mesmo decision tree pacote r pra fazer mrt eh mt antigo dar querer n python rs
21,21,1532121241552822278,2022-06-01 22:05:44+00:00,"se eu pudesse aprenderia React enquanto estudo Python, me dedico a JS, e me aprofundo nos conhecimentos de Hardware...",JorgeKasowski,poder aprender react estudar python dedicar js aprofundar conhecimento hardware
22,22,1532121020890497025,2022-06-01 22:04:51+00:00,Glr de ciências da computação macetando um python e a glr da ENG de computação sendo macetada por C,Glayber16,glr ciência computação macetar python glr eng computação ser macetar c
23,23,1532120703486468096,2022-06-01 22:03:35+00:00,"📣 Nova Oportunidade!

🧑‍💻 Sênior em #powershell e #python
🏙️ Skaylink Brasil
🪙 R$ 5.920
📍 Florianópolis, SC

Candidate-se agora! https://t.co/psj02vws9U

#empregos #jobs #vagas #tecnologia",Tecnovagas1,oportunidade sênior powershell python skaylink brasil r florianópolis sc candidatar https t co psj vws u emprego jobs vago tecnologia
24,24,1532120689347506176,2022-06-01 22:03:32+00:00,"📣 Nova Oportunidade!

🧑‍💻 Júnior em #powershell e #python
🏙️ Skaylink Brasil
🪙 R$ 2.240
📍 Florianópolis, SC

Candidate-se agora! https://t.co/l3RXl1UQCH

#empregos #jobs #vagas #tecnologia",Tecnovagas1,oportunidade júnior powershell python skaylink brasil r florianópolis sc candidatar https t co l rxl uqch emprego jobs vago tecnologia
25,25,1532120121577177090,2022-06-01 22:01:17+00:00,"@import_robs @Emilio_Vaz05 Mas o que vocês usam?!?!? C, Fortran, Python, Julia?",Velho_Tonto,import_robs emilio_vaz usar c fortran python julia
26,26,1532119799320412162,2022-06-01 22:00:00+00:00,E né kk #bolhadev #javascript #python #webdeveloper https://t.co/pKLaRhWajh,CobeClub,né k bolhadev javascript python webdeveloper https t co pklarhwajh
27,27,1532119414040150019,2022-06-01 21:58:28+00:00,"Comecei a mexer um pouquinho com Python em 2018, mas depois parei... tô bolada, sou mt burra 🤦🏻‍♀️",laranprog,começar mexer pouco python parar tô bolar mt burro
28,28,1532119186671128576,2022-06-01 21:57:34+00:00,"@buzz_ladino Aparentemente esses softwares tem tudo interface com python kkk, eh bom demais pra automatizar msm. Que area vc ta trabalhando?",henriquecaetan2,buzz_ladino aparentemente software interface python kkk eh pra automatizar msm area vc ta trabalhar
29,29,1532119058543411200,2022-06-01 21:57:03+00:00,"Tô triste, apaguei uma apostila antiga de estudos em Python q eu tinha montado sem querer 🤡🤡🤡🤡🤡",laranprog,tô triste apagar apostila antigo estudo python q ter montar querer
30,30,1532117335825342467,2022-06-01 21:50:12+00:00,"@letxzz_ Python é muito bom, dá pra aprender o basico em 2 meses, comparado a outras linguagens",Vinnybrunn00,letxzz _ python pra aprender basico comparar linguagem
31,31,1532114997433835521,2022-06-01 21:40:55+00:00,meu deus odeio o discord  odeio python odeio tudo,queijune,deus odiar discord odiar python odiar
32,32,1532113363332907008,2022-06-01 21:34:25+00:00,@henriquecaetan2 To usando python tb mas só pra automatizar as simulações q eu faço no pscad,buzz_ladino,henriquecaetan to usar python tb pra automatizar simulação q pscad
33,33,1532112968816762880,2022-06-01 21:32:51+00:00,estes erros do python vão ser a minha 13th reason istg,proudlydead,erro python th reason istg
34,34,1532112768886775808,2022-06-01 21:32:04+00:00,se eu tive que programar em alguma linguagem que nao seja python nessa prova nao responderei por meus atos,cygnusope,programar algum linguagem nao ser python provar nao responder atos
35,35,1532111529214083072,2022-06-01 21:27:08+00:00,"@gustac01 @BolhaTech mas se vc for tipo muito pika em python pode tentar o mercado sem medo, o salário tmb de programador de python é alto pra krl vale a pena",Lust_mss,gustac bolhatech vc pika python mercar medo salário tmb programador python alto pra krl valer peno
36,36,1532111217329946625,2022-06-01 21:25:54+00:00,"DICA! A Bloomberg vai oferecer um curso gratuito de Python e BQuant para mulheres do mercado financeiro. São 50 vagas. O lançamento do programa será nesta quinta-feira (2), às 11h com um painel de mulheres especialistas. É de graça! 

Link: https://t.co/AuVnwMEV9u",capitaldigital,dica bloomberg oferecer cursar gratuito python bquant mulher mercar financeiro vago lançamento programar ser feirar h painel mulher especialista graça link https t co auvnwmev u
37,37,1532105050939613186,2022-06-01 21:01:23+00:00,"de cara que um amigo do meu colega do projeto simplesmente pegou uma vaga plêno sem experiencia profissional com python e java na fodendo globo, enquanto eu to aqui fudido",BlazingWizzard_,caro amigar colega projeto simplesmente pegar vago plêno experiencia profissional python java foder globo to fudido
38,38,1532104792809652224,2022-06-01 21:00:22+00:00,"Novos vídeos:
🔹Inglês e Inteligência Artificial: Pronúncia termos Algoritmos Genéticos;
🔹Inglês e Inteligência Artificial: Pronúncia termos Visão Computacional.

Saiba mais: https://t.co/Qc9kgNPJOG

#inteligenciaartificial #python #algoritmosgeneticos #visaocomputacional https://t.co/uqrogymICU",iaexpertacademy,vídeo inglês inteligência artificial pronúncia termo algoritmo genético inglês inteligência artificial pronúncia termo visão computacional saber https t co qc kgnpjog python https t co uqrogymicu
39,39,1532104641357434882,2022-06-01 20:59:46+00:00,@aboutmesquita Escreve minha automação em python aí rapidinho,mark96got,aboutmesquita escrever automação python rapidinho
40,40,1532102393323835393,2022-06-01 20:50:50+00:00,@ItsSince79 HOJE python não seria mais negócio pra começar?,vfbsilva,itssince hoje python negócio pra começar
41,41,1532101352909938689,2022-06-01 20:46:42+00:00,@Unidosdados Vc acha que o uso de R/Python vai ser usado por todas as áreas ou é mais hype e dps vai acabar ficando só com um nicho? Hoje na empresa informaram que vão financiar curso de Power BI para todos os funcionários. Acho que pra quem não é tech esse caminho parece mais realista,ilfinancista,unidosdados vc achar usar r python usar área hype dps acabar ficar nicho hoje empresar informar financiar cursar power bi funcionário achar pra tech realistar
42,42,1532100406595227648,2022-06-01 20:42:56+00:00,"@heitordelima D3 é uma biblioteca js, no caso vc codaria em python pra chamar o D3 que vai fazer só a visualização... Enfim, qndo a gente compra com esses pacotes até o Tableau vira uma alternativa viável pra algo rápido...",notyourjaq,heitordelima d biblioteca js casar vc codaria python pra chamar d visualização enfim qndo gente comprar pacote tableau virar alternativo viável pra rápido
43,43,1532095902709858304,2022-06-01 20:25:02+00:00,@SrMillionerd Fiz esse daí e tudo que sei de Python se resume a ele.,caduzaodamassa,srmillionerd fazer daí python resumir
44,44,1532093720039940097,2022-06-01 20:16:22+00:00,"@notyourjaq Não conhecia esse D3, muito interessante. Pq você precisaria desse python no meio do caminho aí?",heitordelima,notyourjaq conhecer d interessante pq precisar python
45,45,1532092851890307075,2022-06-01 20:12:55+00:00,@errorNumber09 o problema é que python não presta pra interface gráfica,pattstarlight,errornumber problema python presto pra interface gráfico
46,46,1532092810832248836,2022-06-01 20:12:45+00:00,"@heitordelima E é MUITO bo fazer Python pra executar R e visualizar em D3...
Até o fim do ano eu pego a certificação da Microsoft meio q à contragosto mas aceitando pela simplicidade. Mas um ambiente R direto ia ser ""lindimais""...",notyourjaq,heitordelima bo python pra executar r visualizar d ano pegar certificação microsoft q contragosto aceitar simplicidade ambientar r direto ir lindimais
47,47,1532092155698810880,2022-06-01 20:10:09+00:00,Toda vez q eu uso o Python pra fazer um cálculo simples me sinto como se estivesse usando uma bazuca pra matar um mosquito 😂😂😂,Nondas1,q usar python pra cálculo simples sentir estar usar bazuca pra matar mosquito
48,48,1532090991863287808,2022-06-01 20:05:31+00:00,"📚 Dica 1 para conciliar o trabalho e os estudos: faça um planejamento semanal, incluindo os momentos reservados para o estudo alternados ao trabalho (dia e horário).

#dev #javascript #python #rubyonrails #vuejs",caiena_dev,dica conciliar trabalhar estudo fazer planejamento semanal incluir momento reservar estudar alternar trabalhar dia horário dev javascript python rubyonrails vuejs
49,49,1532090988201664512,2022-06-01 20:05:31+00:00,"Quer dicas para equilibrar a rotina de trabalho com os estudos sobre desenvolvimento? 📚 Então siga o fio! 🧶

#dev #javascript #python #rubyonrails #vuejs",caiena_dev,dica equilibrar rotina trabalhar estudo desenvolvimento seguir fiar dev javascript python rubyonrails vuejs
50,50,1532089235586572290,2022-06-01 19:58:33+00:00,"Agora é sério, eu refiz todo o python, se faltar algum linha nesse rolê eu mato alguém",IginoOBrabo,sério refazer python faltar algum linha rolê matar alguém
51,51,1532087640836943872,2022-06-01 19:52:13+00:00,To querendo fazer umas Lives estudando sobre uma linguagem de programação tomar coragem na cara hoje. Quero muito me aprofundar em Python para analise de dados ( tenho pouco conhecimento em Programação) espero que de certo vou fazer lives todos os dias as 20h no horario de SP,obigodeme,to querer lives estudar linguagem programação tomar coragem caro hoje aprofundar python analisar dar conhecimento programação esperar certar ir lives dia h horario sp
52,52,1532087549807710209,2022-06-01 19:51:51+00:00,BairesDev oferece vaga para Sergipe-SEDesenvolvedor Python Autêntico Trabalho Remoto Ref 0071P https://t.co/027MpAw18w,infojobsTI,bairesdev oferecer vago sergipe sedesenvolvedor python autêntico trabalhar remoto ref p https t co mpaw w
53,53,1532087332882591745,2022-06-01 19:50:59+00:00,BairesDev oferece vaga para Mato Grosso do Sul-MSDesenvolvedor Python Autêntico Trabalho Remoto Ref 0071P https://t.co/aAQgWAL6bM,infojobsTI,bairesdev oferecer vago matar grosso sul msdesenvolvedor python autêntico trabalhar remoto ref p https t co aaqgwal bm
54,54,1532087289417019396,2022-06-01 19:50:49+00:00,BairesDev oferece vaga para Pará-PADesenvolvedor Python Autêntico Trabalho Remoto Ref 0071P https://t.co/mPbZEkd0HD,infojobsTI,bairesdev oferecer vago parar padesenvolvedor python autêntico trabalhar remoto ref p https t co mpbzekd hd
55,55,1532087252544851974,2022-06-01 19:50:40+00:00,BairesDev oferece vaga para Piauí-PIDesenvolvedor Python Autêntico Trabalho Remoto Ref 0071P https://t.co/RwBsL7HkxP,infojobsTI,bairesdev oferecer vago piauí pidesenvolvedor python autêntico trabalhar remoto ref p https t co rwbsl hkxp
56,56,1532087246777683969,2022-06-01 19:50:39+00:00,BairesDev oferece vaga para Amazonas-AMDesenvolvedor Python Autêntico Trabalho Remoto Ref 0071P https://t.co/ajM7zGZdJH,infojobsTI,bairesdev oferecer vago amazona amdesenvolvedor python autêntico trabalhar remoto ref p https t co ajm zgzdjh
57,57,1532087223985881089,2022-06-01 19:50:33+00:00,BairesDev oferece vaga para São Paulo-SPDesenvolvedor Python Autêntico Trabalho Remoto Ref 0071P https://t.co/eGewxJ6fGU,infojobsTI,bairesdev oferecer vago paulo spdesenvolvedor python autêntico trabalhar remoto ref p https t co egewxj fgu
58,58,1532086161149141001,2022-06-01 19:46:20+00:00,Certeza que esse professor de filosofia é usuário de python.,MMVianakj,professor filosofia usuário python
59,59,1532085770248507394,2022-06-01 19:44:47+00:00,"comecei a aprender programação por python pq todo mundo disse que é mais fácil 

??? eu so burra então, decretado",odeiootaku_,começar aprender programação python pq mundo dizer fácil so burro decretar
60,60,1532083198133518336,2022-06-01 19:34:33+00:00,"@gwidion @adorilson @dunossauro @rochacbruno @PotHix Python faz isso desse jeito já faz algum tempo. É só ver a DB-API, WSGI, ASGI, ... Acho um jeito inteligente de lidar com diferentes necessidades: padroniza o que é consenso e deixa os implementadores se quebrarem 🙂",osantana,gwidion adorilson dunossauro rochacbruno pothix python jeito algum db api wsgi asgi achar jeito inteligente lidar diferente necessidade padronizar consenso deixar implementadores quebrar
61,61,1532082416764043267,2022-06-01 19:31:27+00:00,Finalmente meu certificado de Python saiu 🙌🏻🙌🏻🙌🏻,belasoussa,finalmente certificar python sair
62,62,1532082192066781184,2022-06-01 19:30:33+00:00,"@raelmax Eu gosto dos type hints. Eu só vejo eles me ajudando e nunca atrapalhando, então é bom.

Acho que passei tempo demais no Java antes de voltar pro python. O complicado é conseguir tipar corretamente usando generics do Java e com o Sonar reclamando quando você usa wildcard.",vbmendes,raelmax gostar type hints ver ajudar atrapalhar achar passar java voltar pro python complicar conseguir tipar corretamente usar generics java sonar reclamar wildcard
63,63,1532081186142662656,2022-06-01 19:26:34+00:00,"@dqsandinnertext @BolhaTech substitua null por qualquer que seja a entidade que define vazio explicitamente na linguagem (no caso do python, seria None) (no caso do JS, seria null) e assim por diante",marcell_mz,dqsandinnertext bolhatech substituir null ser entidade definir vaziar explicitamente linguagem casar python none casar js null
64,64,1532080896966553600,2022-06-01 19:25:25+00:00,"@dqsandinnertext @BolhaTech eu sigo o padrão do lint do python: consistência.

se é uma função sem nenhum return além do seu vazio, boto só ""return"" com undefined implícito

se é uma função com outros ""return algo"" então eu coloco ""return null"" pra seguir o padrão de ""algo"", vazio explícito é sempre null",marcell_mz,dqsandinnertext bolhatech seguir padrão lint python consistência função nenhum return vaziar botar return undefined implícito função return colocar return null pra seguir padrão vaziar explícito null
65,65,1532079067377258496,2022-06-01 19:18:08+00:00,"@_lluscas_ Me mandaram um e-mail oferecendo um trabalho pra mexer com uns negócios de Python, até era interessante mas eu não gosto de Python e na verdade eu recusei mais por causa do horário que não ia dar muito certo",dimasdecastro,mandar mail oferecer trabalhar pra mexer negócio python interessante gostar python verdade recusar causar horário ir certar
66,66,1532075026039586817,2022-06-01 19:02:05+00:00,"Vaguinha passando na sua tl! 👨‍💻🗣️📣

#bolhadev #python

Repo: backendbr
Postado em: 01/06/2022
Tags: CLT - PHP - Python

Descrição da vaga: 
Esta é uma vaga de um parceiro da plataforma Coodesh, ao candidatar-s...

Link: https://t.co/5BM54wrkkM",tech_diobis,vaguinha passar tl bolhadev python repo backendbr postar tags clt php python descrição vago vago parceiro plataforma coodesh candidatar s link https t co bm wrkkm
67,67,1532074776222744576,2022-06-01 19:01:05+00:00,BairesDev oferece vaga para Mato Grosso do Sul-MSDesenvolvedor Python Jedi Trabalho Remoto Ref 0071P https://t.co/DbF2tMX2eg,infojobsTI,bairesdev oferecer vago matar grosso sul msdesenvolvedor python jedi trabalhar remoto ref p https t co dbf tmx eg
68,68,1532074661944643585,2022-06-01 19:00:38+00:00,BairesDev oferece vaga para São Paulo-SPDesenvolvedor Python Jedi Trabalho Remoto Ref 0071P https://t.co/GdutXcAJ2m,infojobsTI,bairesdev oferecer vago paulo spdesenvolvedor python jedi trabalhar remoto ref p https t co gdutxcaj m
69,69,1532074081838723072,2022-06-01 18:58:20+00:00,no meu caso vão ser uns programas de média em python kkkkkkk https://t.co/7pd6puLkGC,ThunderShout,casar programar médio python kkkkkkk https t co pd pulkgc
70,70,1532071248205053952,2022-06-01 18:47:04+00:00,"Vaguinha passando na sua tl! 👨‍💻🗣️📣

#bolhadev #python

Repo: backendbr
Postado em: 01/06/2022
Tags: CLT - PHP - Python

Descrição da vaga: 
Esta é uma vaga de um parceiro da plataforma Coodesh, ao candidatar-s...

Link: https://t.co/5BM54wrSak",tech_diobis,vaguinha passar tl bolhadev python repo backendbr postar tags clt php python descrição vago vago parceiro plataforma coodesh candidatar s link https t co bm wrsak
71,71,1532069600216895488,2022-06-01 18:40:31+00:00,"@itsmeirineu Oxe, que nd, python é pra amador, o negócio é brainfuck:
https://t.co/OEj1kdELYS",sseveein,itsmeirineu oxe nd python pra amador negócio brainfuck https t co oej kdelys
72,72,1532067392393605120,2022-06-01 18:31:45+00:00,"tô programando em python, mas lógica de programação é um ngc incrível",gaaardenn,tô programar python lógico programação ngc incrível
73,73,1532065997204508673,2022-06-01 18:26:12+00:00,"@ViUmaVaga Traz vagas para ""júnior"" e ""trainee"" principalmente para Javascript, React e Python. Aí o bot ficará bastante busy!",vinnizius,viumavaga trazer vago júnior trainee principalmente javascript react python bot ficar busy
74,74,1532064549158805504,2022-06-01 18:20:27+00:00,"Iniciando meu terceiro curso de Python. Desta vez um gratuito do Youtube, do Curso em vídeo. Agora vai!

Tô frustrado! Mas prometi que este ano aprenderia Python e não vou recuar nessa porra.",CandangoMA,iniciar cursar python gratuito youtube cursar vídeo tô frustrar prometer ano aprender python ir recuar porra
75,75,1532062721696378881,2022-06-01 18:13:11+00:00,"Agora vou tentar algumas alterações com o Selenium no Python.
E com o VirtualDisplay",plini_o,ir alteração selenium python virtualdisplay
76,76,1532062295576092672,2022-06-01 18:11:30+00:00,"a prfessra da cadeira de python passou uma atividade foda sobre python, prolog, java e alguns fundamentos de programação e a galera foi reclamar no grupo da sala, falando que alguns conteudos nao foram dados. ai ela mandou um ""mas isso é logica de programação vcs devem saber""",felipeirasss,prfessra cadeira python passar atividade foder python prolog java fundamento programação galera reclamar sala falar conteudos nao dar ai mandar logica programação vcs
77,77,1532062189749784577,2022-06-01 18:11:05+00:00,"@osantana Eu que fui criado no Java e acabei no PHP, curti quando a linguagem ganhou suporte a tipos. Mas posso estar fazendo uma comparação tosca pq não sei se os tipos do Python são como Typescript, que não valem (quase) nada em execução porque no final das contas vira tudo Javascript.",gstrb,osantana criar java acabar php curtir linguagem ganhar suportar tipo fazer comparação tosco pq tipo python typescript valer quase execução contar virar javascript
78,78,1532062069918662656,2022-06-01 18:10:36+00:00,Uma semana que estou tentando colocar o crawler em produção. Já  fiz e refiz versões em Python e JavaScript.,plini_o,semana tentar colocar crawler produção fazer refazer versão python javascript
79,79,1532060960789516289,2022-06-01 18:06:12+00:00,@danilologic É bem em python mesmo kkkkk,thiagomcosta8,danilologic python kkkkk
80,80,1532059923273875457,2022-06-01 18:02:04+00:00,"Vaguinha passando na sua tl! 👨‍💻🗣️📣

#bolhadev #python

Repo: backendbr
Postado em: 01/06/2022
Tags: CLT - Pleno - Python

Sobre a Passei Direto

Prazer, somos a **PD**, parte do ecossistema **UOL EdTech** e ...

Link: https://t.co/L8wjRR5DC1",tech_diobis,vaguinha passar tl bolhadev python repo backendbr postar tags clt pleno python passar direto prazer pd ecossistema uol edtech link https t co l wjrr dc
